{
    "title": "What's Up with AI?",
    "speakers": [
        "Terry Winograd"
    ],
    "urls": [
        "https://www.youtube.com/watch?v=F-OxHWWg59o"
    ],
    "extra": "Stanford CS547 HCI Seminar | Winter 2026 \n This lecture covers:\n• A better understanding of what AI systems are actually doing\n• What concerns we should have about where they are going \n • How to approach issues with the recognition that large language models and similar systems have no real understanding or intention, even though they often promote the illusion that they do\nTerry Winograd is Professor of Computer Science Emeritus at Stanford, where he created and directed for 20 years the Human-Computer Interaction Group and the teaching and research program in Human-Computer Interaction Design.",
    "embed": false
}
