{
    "title": "Practice of Art: Introduction",
    "extra": "University of California, Berkeley\nART 8 LEC 001 Sp11 \nIntroduction to Visual Thinking",
    "speakers": [
        "John S. McNamara"
    ],
    "audioQuality": {
        "rating": 3,
        "weight": 1,
        "spread": 0
    },
    "videoQuality": {
        "rating": 4,
        "weight": 1,
        "spread": 0
    },
    "urls": [
        "https://archive.org/details/ucberkeley_webcast_itunesu_438309009/01.+2011-01-24+-+Lecture+1.mp4"
    ]
}