{
    "title": "Language",
    "urls": [
        "https://www.youtube.com/watch?v=SIOQgY1tqrU"
    ],
    "speakers": [
        "Professor Robert Sapolsky"
    ],
    "year": 2010,
    "extra": "describes the similarities and differences between different human and animal languages. He focuses on how we use language to communicate with each other, how we communicate with animals, and how animals commute with each other. Stanford 23. Language",
    "embed": true,
    "topics": {
        "linguistics": 1
    }
}