{
    "title": "Using Technology to Rethink How We Teach and Learn",
    "urls": [
        "https://www.youtube.com/watch?v=HDpyEwfMqPA"
    ],
    "embed": true,
    "learnings": [
        {
            "get to know the early history of Khan academy": {
                "rating": 5,
                "weight": 0
            }
        }
    ]
}