{
    "title": "The Problem with Video Games and Learning",
    "urls": [
        "https://www.youtube.com/watch?v=qvPY3_bBfZM"
    ],
    "speakers": [
        "Maria Cipollone"
    ],
    "extra": "Stanford; From the Interactive Media & games Seminar Series; Maria Cipollone, UX/Design Researcher from Zynga looks at how scholars and practitioners have long discussed the benefits of video games for motivation and learning. But the culture of video games does not mesh well with the culture of institutional education. This talk discusses contextualizes video games within the longer history of 'ed tech' to discuss what may be different at this point in educational history, or what may be more of the same.",
    "embed": true
}
