{
    "title": "Lifelong Kindergarten: Design, Play, Share, Learn",
    "extra": "Mitch Resnick, Professor of Learning Research at the MIT Media Lab, discusses and demonstrates how new technologies can help extend kindergarten-style learning to people of all ages, enabling everyone to learn through designing, playing, and sharing.",
    "year": 2010,
    "urls": [
        "https://www.youtube.com/watch?v=z7rlLml5ReQ"
    ],
    "embed": true
}
